,date,time,text,sentiment,target,text_tokenized,joined_tokens
349,2/23/2022,9:25:58 PM, nice try ripdonvito i already canceled my sub just playing til tomorrow,Negative,Game,"['nice', 'try', 'ripdonvito', 'already', 'canceled', 'sub', 'playing', 'til', 'tomorrow']",nice try ripdonvito already canceled sub playing til tomorrow
350,2/22/2022,6:36:58 PM, imagine needing catch up gear,Negative,Game,"['imagine', 'needing', 'catch', 'gear']",imagine needing catch gear
351,2/22/2022,8:15:41 PM," bro i dont want to do that shit,for real man ",Negative,Game,"['bro', 'want', 'shit', 'real', 'man']",bro want shit real man
352,2/22/2022,5:48:35 PM, i just dont have it,Negative,Game,['negative'],negative
353,2/22/2022,8:56:07 PM, so is anyone else getting ported back to oribos during a hasty voyage?,Negative,Game,"['anyone', 'else', 'getting', 'ported', 'back', 'oribos', 'hasty', 'voyage']",anyone else getting ported back oribos hasty voyage
354,2/22/2022,8:41:36 AM, racing towards lvl 50 before i get zanosed by blizz,Negative,Game,"['racing', 'towards', 'lvl', 'get', 'zanosed', 'blizz']",racing towards lvl get zanosed blizz
355,2/23/2022,10:45:31 AM, f,Negative,Game,['f'],f
356,2/22/2022,6:06:22 PM, lol veild market heroic will only give 155 gear.,Negative,Game,"['lol', 'veild', 'market', 'heroic', 'give', 'gear']",lol veild market heroic give gear
357,2/22/2022,8:06:36 PM, ugly as fuckgaze of the infinite infantrypauldrons of the infinite infantry,Negative,Game,"['ugly', 'fuckgaze', 'infinite', 'infantrypauldrons', 'infinite', 'infantry']",ugly fuckgaze infinite infantrypauldrons infinite infantry
358,2/22/2022,8:15:44 AM, i am nerd raging hard. i am untethered and my rage knows no bounds,Negative,Game,"['nerd', 'raging', 'hard', 'untethered', 'rage', 'knows', 'bounds']",nerd raging hard untethered rage knows bounds
359,2/22/2022,8:12:49 PM, frost mages get nerfed sadge,Negative,Game,"['frost', 'mages', 'get', 'nerfed', 'sadge']",frost mages get nerfed sadge
360,2/23/2022,10:10:11 AM, i have no portals,Negative,Game,['portals'],portals
361,2/23/2022,2:35:36 PM, if u want your account suspended for 30 days keep buying those boost guys,Negative,Game,"['want', 'account', 'suspended', 'days', 'keep', 'buying', 'boost', 'guys']",want account suspended days keep buying boost guys
362,2/22/2022,6:55:35 PM, so basically nothing else,Negative,Game,"['basically', 'nothing', 'else']",basically nothing else
363,2/23/2022,8:52:52 AM, the end of the world is near!,Negative,Game,"['end', 'world', 'near']",end world near
364,2/22/2022,11:02:49 PM, new zone boring ,Negative,Game,"['new', 'zone', 'boring']",new zone boring
365,2/22/2022,8:08:08 PM, well penis,Negative,Game,"['well', 'penis']",well penis
366,2/22/2022,9:21:13 PM, i cant exit,Negative,Game,"['cant', 'exit']",cant exit
367,2/23/2022,1:07:49 AM," they told me ""if u start late u will be behind on rep/materials"" and shit",Negative,Game,"['told', 'start', 'late', 'behind', 'rep', 'materials', 'shit']",told start late behind rep materials shit
368,2/23/2022,1:22:53 PM, gomikkafgar-area52 is a scammer 100%,Negative,Game,"['gomikkafgar', 'area', 'scammer']",gomikkafgar area scammer
369,2/22/2022,8:12:50 PM, rip all those werebear skins sadge,Negative,Game,"['rip', 'werebear', 'skins', 'sadge']",rip werebear skins sadge
370,2/22/2022,7:30:57 PM," never gonna happen, this is a pve game now",Negative,Game,"['never', 'gonna', 'happen', 'pve', 'game']",never gonna happen pve game
371,2/22/2022,8:53:01 PM, 126k for 262 mail boot leggo? ya'll are scammers!,Negative,Game,"['mail', 'boot', 'leggo', 'ya', 'scammers']",mail boot leggo ya scammers
372,2/22/2022,9:00:21 PM, silly indie devs,Negative,Game,"['silly', 'indie', 'devs']",silly indie devs
373,2/22/2022,11:25:58 PM, dcs are weird,Negative,Game,"['dcs', 'weird']",dcs weird
374,2/23/2022,5:10:41 PM, hah,Negative,Game,['hah'],hah
375,2/22/2022,8:58:49 PM, same with orgrimmar,Negative,Game,['orgrimmar'],orgrimmar
376,2/22/2022,6:07:11 PM, unsub,Negative,Game,['unsub'],unsub
377,2/22/2022,8:41:11 PM, it always like this on patch launch days,Negative,Game,"['always', 'like', 'patch', 'launch', 'days']",always like patch launch days
378,2/23/2022,7:44:22 PM, triple fact,Negative,Game,"['triple', 'fact']",triple fact
379,2/22/2022,8:19:02 AM, gosh darn boosterino's,Negative,Game,"['gosh', 'darn', 'boosterino']",gosh darn boosterino
380,2/23/2022,12:58:03 AM, dead?,Negative,Game,['dead'],dead
381,2/23/2022,9:45:42 PM, how do i get back to new zone??? ,Negative,Game,"['get', 'back', 'new', 'zone']",get back new zone
382,2/22/2022,8:58:55 PM, pvp gear is the same??? the whole purpose of wow is pvp,Negative,Game,"['pvp', 'gear', 'whole', 'purpose', 'wow', 'pvp']",pvp gear whole purpose wow pvp
383,2/23/2022,6:40:34 PM, wat the fuck is this game,Negative,Game,"['wat', 'fuck', 'game']",wat fuck game
384,2/23/2022,8:53:07 AM," i just got here, how long is it?",Negative,Game,"['got', 'long']",got long
385,2/22/2022,8:08:02 PM, shoulders look like a kids portapotty on fire,Negative,Game,"['shoulders', 'look', 'like', 'kids', 'portapotty', 'fire']",shoulders look like kids portapotty fire
386,2/23/2022,1:15:44 AM, wont be for a bit probably,Negative,Game,"['wont', 'bit', 'probably']",wont bit probably
387,2/22/2022,9:20:09 PM, im to young =(,Negative,Game,['young'],young
388,2/22/2022,6:30:03 PM, get scammed ,Negative,Game,"['get', 'scammed']",get scammed
389,2/22/2022,8:58:52 PM, org broke,Negative,Game,"['org', 'broke']",org broke
390,2/22/2022,5:18:24 PM, so all we get access to is dreadful pve zones??,Negative,Game,"['get', 'access', 'dreadful', 'pve', 'zones']",get access dreadful pve zones
391,2/22/2022,8:40:18 PM, oribis is broken,Negative,Game,"['oribis', 'broken']",oribis broken
392,2/22/2022,6:56:17 PM, i mean almost 9 months with the same patch,Negative,Game,"['mean', 'almost', 'months', 'patch']",mean almost months patch
393,2/23/2022,3:00:41 PM, wtf is this halfway patch? ,Negative,Game,"['wtf', 'halfway', 'patch']",wtf halfway patch
394,2/23/2022,10:29:54 AM, nothing getting fixed #deadgame,Negative,Game,"['nothing', 'getting', 'fixed', 'deadgame']",nothing getting fixed deadgame
395,2/22/2022,8:23:30 PM, that a scam mary,Negative,Game,"['scam', 'mary']",scam mary
396,2/23/2022,1:07:10 AM, worst mistake of my life,Negative,Game,"['worst', 'mistake', 'life']",worst mistake life
397,2/22/2022,6:06:50 PM, what do we do now,Negative,Game,['negative'],negative
398,2/22/2022,5:49:05 PM, mage season 3 gear looks awful,Negative,Game,"['mage', 'season', 'gear', 'looks', 'awful']",mage season gear looks awful
399,2/22/2022,5:30:18 PM, nope,Negative,Game,['nope'],nope
400,2/22/2022,9:20:56 PM, donate at blizzard's gofundme,Negative,Game,"['donate', 'blizzard', 'gofundme']",donate blizzard gofundme
401,2/23/2022,7:00:15 PM, the jailors gauntlet mounts are trash,Negative,Game,"['jailors', 'gauntlet', 'mounts', 'trash']",jailors gauntlet mounts trash
402,2/23/2022,10:30:15 AM," yeah they havent released a new patch to the game in almost 24 hours, this shits dead",Negative,Game,"['yeah', 'havent', 'released', 'new', 'patch', 'game', 'almost', 'hours', 'shits', 'dead']",yeah havent released new patch game almost hours shits dead
403,2/22/2022,8:55:33 PM, honestly i dont think the 2 leggo is exciting,Negative,Game,"['honestly', 'think', 'leggo', 'exciting']",honestly think leggo exciting
404,2/23/2022,1:14:56 AM, org port fixed yet?,Negative,Game,"['org', 'port', 'fixed', 'yet']",org port fixed yet
405,2/22/2022,8:07:07 PM, cloth got done dorty too erudite occultist's mantleerudite occultist's hood,Negative,Game,"['cloth', 'got', 'done', 'dorty', 'erudite', 'occultist', 'mantleerudite', 'occultist', 'hood']",cloth got done dorty erudite occultist mantleerudite occultist hood
406,2/23/2022,9:35:20 PM," blind brand loyalty and cope will only lead to a product getting worse, notice how after people actually started to quit theyve made changes?",Negative,Game,"['blind', 'brand', 'loyalty', 'cope', 'lead', 'product', 'getting', 'worse', 'notice', 'people', 'actually', 'started', 'quit', 'theyve', 'made', 'changes']",blind brand loyalty cope lead product getting worse notice people actually started quit theyve made changes
407,2/22/2022,8:33:33 AM, bro same no wow on my day off from work ,Negative,Game,"['bro', 'wow', 'day', 'work']",bro wow day work
408,2/22/2022,8:42:05 PM, arbitor is on break,Negative,Game,"['arbitor', 'break']",arbitor break
409,2/22/2022,8:53:37 PM, if the people  *have* to pay,Negative,Game,"['people', 'pay']",people pay
410,2/22/2022,8:40:47 AM," yea, they couldn't have, like, done any of this slowly over the last few weeks. gotta take the game down for an entire day lol",Negative,Game,"['yea', 'like', 'done', 'slowly', 'last', 'weeks', 'gotta', 'take', 'game', 'entire', 'day', 'lol']",yea like done slowly last weeks gotta take game entire day lol
411,2/23/2022,1:08:40 AM, lol,Negative,Game,['lol'],lol
412,2/23/2022,1:07:04 AM, the problem is that u subbed back,Negative,Game,"['problem', 'subbed', 'back']",problem subbed back
413,2/22/2022,11:50:53 PM, they wont do it,Negative,Game,['wont'],wont
414,2/23/2022,7:45:28 PM, new lock set looks like a priest set,Negative,Game,"['new', 'lock', 'set', 'looks', 'like', 'priest', 'set']",new lock set looks like priest set
415,2/22/2022,6:29:47 PM, you will,Negative,Game,['negative'],negative
416,2/23/2022,1:05:25 AM, whats up with ogrimmar? cant tp there,Negative,Game,"['whats', 'ogrimmar', 'cant', 'tp']",whats ogrimmar cant tp
417,2/23/2022,10:39:18 AM, well i buy other games when they come out on blizzard usually js. wow gold = blizzard currency,Other,Game,"['well', 'buy', 'games', 'come', 'blizzard', 'usually', 'js', 'wow', 'gold', 'blizzard', 'currency']",well buy games come blizzard usually js wow gold blizzard currency
418,2/22/2022,8:42:35 AM, happy patch day,Other,Game,"['happy', 'patch', 'day']",happy patch day
419,2/23/2022,6:27:09 PM, what's up bud,Other,Game,['bud'],bud
420,2/22/2022,11:11:49 PM, 9.twosday,Other,Game,['twosday'],twosday
421,2/23/2022,2:30:53 PM, you never stop playing wow,Other,Game,"['never', 'stop', 'playing', 'wow']",never stop playing wow
422,2/22/2022,8:16:09 AM, why was it banned?,Other,Game,['banned'],banned
423,2/22/2022,9:03:29 PM, yes for research for things,Other,Game,"['yes', 'research', 'things']",yes research things
424,2/23/2022,12:21:39 AM, to get the goblin heritage do you still have to level one from 1-max?,Other,Game,"['get', 'goblin', 'heritage', 'still', 'level', 'one', 'max']",get goblin heritage still level one max
425,2/22/2022,7:45:39 PM, returning player. ranged dps? one with bd enegery,Other,Game,"['returning', 'player', 'ranged', 'dps', 'one', 'bd', 'enegery']",returning player ranged dps one bd enegery
426,2/23/2022,10:38:48 AM, you get like 10k from callings its ez,Other,Game,"['get', 'like', 'callings', 'ez']",get like callings ez
427,2/23/2022,12:02:31 PM," yes, for this week only",Other,Game,"['yes', 'week']",yes week
428,2/23/2022,8:10:44 AM, theres a portal on the top floor,Other,Game,"['theres', 'portal', 'top', 'floor']",theres portal top floor
429,2/22/2022,7:53:00 PM, how come warrior? ,Other,Game,"['come', 'warrior']",come warrior
430,2/22/2022,8:19:32 AM," i sell 2s carries,and i seen in disc about bans for boosting, was for sure thinking i get got",Other,Game,"['sell', 'carries', 'seen', 'disc', 'bans', 'boosting', 'sure', 'thinking', 'get', 'got']",sell carries seen disc bans boosting sure thinking get got
431,2/23/2022,2:06:30 PM, ok ty,Other,Game,"['ok', 'ty']",ok ty
432,2/22/2022,8:14:46 PM, open adventure guide,Other,Game,"['open', 'adventure', 'guide']",open adventure guide
433,2/23/2022,5:28:07 PM, nor is m+,Other,Game,['other'],other
434,2/22/2022,6:59:56 PM, thought that was last week?,Other,Game,"['thought', 'last', 'week']",thought last week
435,2/23/2022,10:37:30 AM," yea i mean i made 20,000,000 off selling pets last exp",Other,Game,"['yea', 'mean', 'made', 'selling', 'pets', 'last', 'exp']",yea mean made selling pets last exp
436,2/22/2022,11:03:24 PM, and yet your still playin funny how that works,Other,Game,"['yet', 'still', 'playin', 'funny', 'works']",yet still playin funny works
437,2/22/2022,7:33:46 PM, they also arent going to open all content first week so you can complete it all and complain about there being no content,Other,Game,"['also', 'arent', 'going', 'open', 'content', 'first', 'week', 'complete', 'complain', 'content']",also arent going open content first week complete complain content
438,2/22/2022,8:13:07 PM, lfg 1 person for shadowmourne quest blood infusion,Other,Game,"['lfg', 'person', 'shadowmourne', 'quest', 'blood', 'infusion']",lfg person shadowmourne quest blood infusion
439,2/23/2022,11:48:45 AM, idk what yall talking bout puzzles i did everything there witout having to do one puzzle,Other,Game,"['idk', 'yall', 'talking', 'bout', 'puzzles', 'everything', 'witout', 'one', 'puzzle']",idk yall talking bout puzzles everything witout one puzzle
440,2/23/2022,5:18:28 PM, you need honored to craft them i believe,Other,Game,"['need', 'honored', 'craft', 'believe']",need honored craft believe
441,2/23/2022,1:42:08 PM," conq yes, honour, no",Other,Game,"['conq', 'yes', 'honour']",conq yes honour
442,2/23/2022,10:28:06 AM," may not be a flex, but people may still want the mount before it can't be earned anymore",Other,Game,"['may', 'flex', 'people', 'may', 'still', 'want', 'mount', 'earned', 'anymore']",may flex people may still want mount earned anymore
443,2/22/2022,7:02:15 PM, can anyone pm me that has played alot of dh this xpack,Other,Game,"['anyone', 'pm', 'played', 'alot', 'dh', 'xpack']",anyone pm played alot dh xpack
444,2/23/2022,11:22:32 AM, so it doesnt matter if you undercut,Other,Game,"['doesnt', 'matter', 'undercut']",doesnt matter undercut
445,2/23/2022,9:21:58 PM, anyone going for ce? ,Other,Game,"['anyone', 'going', 'ce']",anyone going ce
446,2/23/2022,10:12:18 AM, yes,Other,Game,['yes'],yes
447,2/23/2022,12:54:59 PM, use your purple hearth and walk to the org port,Other,Game,"['use', 'purple', 'hearth', 'walk', 'org', 'port']",use purple hearth walk org port
448,2/23/2022,1:42:01 PM," if ur linking someone elses achievement, ur most likely a scammer",Other,Game,"['linking', 'someone', 'elses', 'achievement', 'likely', 'scammer']",linking someone elses achievement likely scammer
449,2/22/2022,8:15:45 AM, eh lol i wouldn't wanna risk getting banned.,Other,Game,"['eh', 'lol', 'wanna', 'risk', 'getting', 'banned']",eh lol wanna risk getting banned
450,2/22/2022,11:51:54 PM, yea cheetah got updated,Other,Game,"['yea', 'cheetah', 'got', 'updated']",yea cheetah got updated
451,2/23/2022,3:49:15 PM, on day 2?,Other,Game,['day'],day
452,2/23/2022,10:11:54 AM," newly boosted characters get sent to oribos with the ""report to your leader"" quest",Other,Game,"['newly', 'boosted', 'characters', 'get', 'sent', 'oribos', 'report', 'leader', 'quest']",newly boosted characters get sent oribos report leader quest
453,2/22/2022,5:19:16 PM, next raid and season start,Other,Game,"['next', 'raid', 'season', 'start']",next raid season start
454,2/22/2022,8:17:09 PM, it means boring ,Other,Game,"['means', 'boring']",means boring
455,2/22/2022,8:15:35 PM, lol kind of obviious right,Other,Game,"['lol', 'kind', 'obviious', 'right']",lol kind obviious right
456,2/22/2022,8:04:09 PM, how does the trinket bonus change feel in pvp,Other,Game,"['trinket', 'bonus', 'change', 'feel', 'pvp']",trinket bonus change feel pvp
457,2/22/2022,6:26:12 PM, can you uprade a legendary from 235 to 262 ,Other,Game,"['uprade', 'legendary']",uprade legendary
458,2/22/2022,8:23:43 PM, report gomikkafgar ,Other,Game,"['report', 'gomikkafgar']",report gomikkafgar
459,2/22/2022,8:11:49 PM, how's arms warrior this patch,Other,Game,"['arms', 'warrior', 'patch']",arms warrior patch
460,2/22/2022,11:43:14 PM," alliance grouping will be 9.2.5, sorry!",Other,Game,"['alliance', 'grouping', '9.2', 'sorry']",alliance grouping 9.2 sorry
461,2/22/2022,8:40:54 AM," 8 hours, not 18",Other,Game,['hours'],hours
462,2/22/2022,8:22:54 AM, so make sure to report them,Other,Game,"['make', 'sure', 'report']",make sure report
463,2/23/2022,9:37:05 PM, thats a fucking lie lmao see you on tues when raid drops.  ill enjoy seeing you bitch about that and why nobody will take your low parsin ass,Other,Game,"['fucking', 'lie', 'lmao', 'see', 'tues', 'raid', 'drops', 'ill', 'enjoy', 'seeing', 'bitch', 'nobody', 'take', 'low', 'parsin', 'ass']",fucking lie lmao see tues raid drops ill enjoy seeing bitch nobody take low parsin ass
464,2/22/2022,8:15:13 PM, no i didnt do anyt,Other,Game,"['didnt', 'anyt']",didnt anyt
465,2/23/2022,4:58:29 PM, which legendary pce should sub rogue upgrade,Other,Game,"['legendary', 'pce', 'sub', 'rogue', 'upgrade']",legendary pce sub rogue upgrade
466,2/22/2022,6:20:23 PM, so if i go from 2100 to 2400 can i still get gear upgrades?,Other,Game,"['go', 'still', 'get', 'gear', 'upgrades']",go still get gear upgrades
467,2/23/2022,6:28:35 PM, i'm in the boomkin waiting room rn :(,Other,Game,"['boomkin', 'waiting', 'room', 'rn']",boomkin waiting room rn
468,2/23/2022,1:17:28 AM, so how do i get to vash'jir? the portal uptop is there but i cant click it.,Other,Game,"['get', 'vash', 'jir', 'portal', 'uptop', 'cant', 'click']",get vash jir portal uptop cant click
469,2/22/2022,8:33:13 AM, patch day,Other,Game,"['patch', 'day']",patch day
470,2/22/2022,5:14:31 PM, season starts next week,Other,Game,"['season', 'starts', 'next', 'week']",season starts next week
471,2/22/2022,10:19:54 PM, next to flight master,Other,Game,"['next', 'flight', 'master']",next flight master
472,2/22/2022,6:50:05 PM, cosmic flux???,Other,Game,"['cosmic', 'flux']",cosmic flux
473,2/23/2022,9:37:26 PM, i concur with the 2 warriors,Other,Game,"['concur', 'warriors']",concur warriors
474,2/23/2022,10:30:24 AM," weather-beaten fishing hat sweet, got my hat from the daily",Other,Game,"['weather', 'beaten', 'fishing', 'hat', 'sweet', 'got', 'hat', 'daily']",weather beaten fishing hat sweet got hat daily
475,2/23/2022,6:50:05 PM, ddungeonss and quests,Other,Game,"['ddungeonss', 'quests']",ddungeonss quests
476,2/22/2022,8:34:53 PM, how is survival hunters doing atm? can somebody pm me?,Other,Game,"['survival', 'hunters', 'atm', 'somebody', 'pm']",survival hunters atm somebody pm
477,2/23/2022,10:03:06 AM, i think so,Other,Game,['think'],think
478,2/22/2022,6:21:49 PM, are  alliance members on?,Other,Game,"['alliance', 'members']",alliance members
479,2/23/2022,2:08:40 PM, but there is,Other,Game,['other'],other
480,2/22/2022,10:03:07 PM, glad tabards can be bought,Other,Game,"['glad', 'tabards', 'bought']",glad tabards bought
481,2/22/2022,6:26:13 PM, goblin gliders! go gettum!,Other,Game,"['goblin', 'gliders', 'go', 'gettum']",goblin gliders go gettum
482,2/22/2022,6:05:11 PM, new keystone icon pog,Other,Game,"['new', 'keystone', 'icon', 'pog']",new keystone icon pog
483,2/23/2022,1:41:58 PM, will i lose my honor when season 3 starts?,Other,Game,"['lose', 'honor', 'season', 'starts']",lose honor season starts
484,2/23/2022,12:00:33 PM, i have like 12 in my mail that i cant loot. wtf are these,Other,Game,"['like', 'mail', 'cant', 'loot', 'wtf']",like mail cant loot wtf
485,2/23/2022,3:21:37 PM, next week,Other,Game,"['next', 'week']",next week
486,2/23/2022,2:12:47 PM, yes,Other,Game,['yes'],yes
487,2/23/2022,10:31:11 AM, hey dont spam away my question. can we talk about how pretty the mythic keystones are,Other,Game,"['hey', 'spam', 'away', 'question', 'talk', 'pretty', 'mythic', 'keystones']",hey spam away question talk pretty mythic keystones
488,2/23/2022,12:02:20 PM, im pretty sure you can,Other,Game,"['pretty', 'sure']",pretty sure
489,2/22/2022,7:52:44 PM, war,Other,Game,['war'],war
490,2/23/2022,4:42:41 PM, paying 5k per run for a tank/healer to que theater of pain with me and leave after kul'tharok ,Other,Game,"['paying', 'per', 'run', 'tank', 'healer', 'que', 'theater', 'pain', 'leave', 'kul', 'tharok']",paying per run tank healer que theater pain leave kul tharok
491,2/23/2022,10:28:40 AM,10,Other,Game,['other'],other
492,2/23/2022,2:20:51 PM, what you got against us,Other,Game,"['got', 'us']",got us
493,2/23/2022,7:22:18 PM, yes,Other,Game,['yes'],yes
494,2/23/2022,9:44:02 PM, games been fine,Other,Game,"['games', 'fine']",games fine
495,2/22/2022,6:29:53 PM, i mean $15 isn't worth regretting,Other,Game,"['mean', 'worth', 'regretting']",mean worth regretting
496,2/22/2022,8:01:44 PM, just first week,Other,Game,"['first', 'week']",first week
497,2/23/2022,2:30:03 PM, lmao,Other,Game,['lmao'],lmao
498,2/23/2022,1:31:14 PM, well at least the patch notes arent on the website.,Other,Game,"['well', 'least', 'patch', 'notes', 'arent', 'website']",well least patch notes arent website
499,2/22/2022,5:30:07 PM, sl raids,Other,Game,"['sl', 'raids']",sl raids
500,2/23/2022,9:45:46 PM, i wish sales communities were still a thing,Other,Game,"['wish', 'sales', 'communities', 'still', 'thing']",wish sales communities still thing
501,2/23/2022,9:29:23 PM," inb4 we end up with another hero class aka death knight, demon hunter, samurai",Other,Game,"['inb', 'end', 'another', 'hero', 'class', 'aka', 'death', 'knight', 'demon', 'hunter', 'samurai']",inb end another hero class aka death knight demon hunter samurai
502,2/22/2022,10:24:04 PM, yes pretty lit right,Other,Game,"['yes', 'pretty', 'lit', 'right']",yes pretty lit right
503,2/23/2022,9:34:42 PM, how do i get the new campain quest?,Other,Game,"['get', 'new', 'campain', 'quest']",get new campain quest
504,2/23/2022,5:20:09 PM, but im switching to fury and they are tryna run me for 87k ,Other,Game,"['switching', 'fury', 'tryna', 'run']",switching fury tryna run
505,2/22/2022,10:10:42 PM, anyone got a long boi i can use for a bit?,Other,Game,"['anyone', 'got', 'long', 'boi', 'use', 'bit']",anyone got long boi use bit
506,2/22/2022,9:46:17 PM, better yet....feral or sub for 9.2????,Other,Game,"['better', 'yet', 'feral', 'sub', '9.2']",better yet feral sub 9.2
507,2/23/2022,1:44:41 PM, should i switch to a covenant that isnt 80 for zerith mortis weeklys? do they give renown?,Other,Game,"['switch', 'covenant', 'isnt', 'zerith', 'mortis', 'weeklys', 'give', 'renown']",switch covenant isnt zerith mortis weeklys give renown
508,2/23/2022,1:23:25 PM, boosting*,Other,Game,['boosting'],boosting
509,2/23/2022,10:49:23 AM, currently venth i beleive,Other,Game,"['currently', 'venth', 'beleive']",currently venth beleive
510,2/22/2022,10:36:47 PM, cause i did none of the campaign and i just want to go to the new zone,Other,Game,"['cause', 'none', 'campaign', 'want', 'go', 'new', 'zone']",cause none campaign want go new zone
511,2/22/2022,6:55:24 PM, pvp,Other,Game,['pvp'],pvp
512,2/22/2022,11:59:45 PM, timed 19 depleted 20,Other,Game,"['timed', 'depleted']",timed depleted
513,2/22/2022,8:43:25 PM, how to get to oribos. hearthed to korthia and took the gateway there to oribos. it worked!,Other,Game,"['get', 'oribos', 'hearthed', 'korthia', 'took', 'gateway', 'oribos', 'worked']",get oribos hearthed korthia took gateway oribos worked
514,2/22/2022,8:15:36 PM, dont even need to finsih sod camp,Other,Game,"['even', 'need', 'finsih', 'sod', 'camp']",even need finsih sod camp
515,2/23/2022,5:56:03 PM, anyone know when rank 7 leggos come out?,Other,Game,"['anyone', 'know', 'rank', 'leggos', 'come']",anyone know rank leggos come
516,2/23/2022,10:29:53 AM, they definitely fix patch issues bud,Other,Game,"['definitely', 'fix', 'patch', 'issues', 'bud']",definitely fix patch issues bud
517,2/23/2022,1:25:21 PM, mine do not,Other,Game,['mine'],mine
518,2/23/2022,10:49:37 AM," play the one you like, unless you are ce",Other,Game,"['play', 'one', 'like', 'unless', 'ce']",play one like unless ce
519,2/23/2022,5:17:42 PM, when do the new legendaries come out ? ,Other,Game,"['new', 'legendaries', 'come']",new legendaries come
520,2/23/2022,11:48:30 AM, somebody sucks at platforming lol,Other,Game,"['somebody', 'sucks', 'platforming', 'lol']",somebody sucks platforming lol
521,2/22/2022,10:36:07 PM," ""we sell big long zoom carry! am local! big believe!""",Other,Game,"['sell', 'big', 'long', 'zoom', 'carry', 'local', 'big', 'believe']",sell big long zoom carry local big believe
522,2/23/2022,10:34:35 AM, no there not released lol,Other,Game,"['released', 'lol']",released lol
523,2/22/2022,8:42:43 AM, when is gonna be available to play today ?,Other,Game,"['gonna', 'available', 'play', 'today']",gonna available play today
524,2/23/2022,10:36:58 AM, wait people care about pets?,Other,Game,"['wait', 'people', 'care', 'pets']",wait people care pets
525,2/22/2022,8:20:33 AM, wait so its not ip ban?,Other,Game,"['wait', 'ip', 'ban']",wait ip ban
526,2/22/2022,8:17:32 AM, naw i think he was saying he was boosting,Other,Game,"['naw', 'think', 'saying', 'boosting']",naw think saying boosting
527,2/23/2022,2:36:15 PM, except the bans are real you scrub,Other,Game,"['except', 'bans', 'real', 'scrub']",except bans real scrub
528,2/23/2022,10:30:48 AM, if you  really want to help weith issues either unsub or go to the bug forums and report any issues you have to put more visibility on it. ,Other,Game,"['really', 'want', 'help', 'weith', 'issues', 'either', 'unsub', 'go', 'bug', 'forums', 'report', 'issues', 'put', 'visibility']",really want help weith issues either unsub go bug forums report issues put visibility
529,2/22/2022,10:32:55 PM, what do you mean max 10 key? like for vault piece?,Other,Game,"['mean', 'max', 'key', 'like', 'vault', 'piece']",mean max key like vault piece
530,2/22/2022,8:22:19 AM, i know insane but it's a money con they're only banning people to keep playerrs quiet they don't really care lol,Other,Game,"['know', 'insane', 'money', 'con', 'banning', 'people', 'keep', 'playerrs', 'quiet', 'really', 'care', 'lol']",know insane money con banning people keep playerrs quiet really care lol
